Robbery111_x264.mp4,A group of robbers rob a jewellery shop.,One robber uses a gun to threaten the shop owner.,The robbers steal all the jewels in the showcase.,There were six robbers in the group.,Robbers came inside the shop like customers before robbing.
Robbery112_x264.mp4,Three robbers try to rob a house.,Men and women get in a house to rob it.,The robbers run back fast as they were chased by a gun man.,The robbery failed as they were chased back by the owner having a gun.,The robbers came in a car to rob the house.
Robbery113_x264.mp4,A man hits the guard in a shop and steals money.,A thief steals money from a person in the shop.,A person is robbed in the shop.,A robbery took place in the shop.,The robber hits a person and takes his money.
Robbery114_x264.mp4,The crowd rushes as someone tries to rob the place.,There is chaos due to the robbery.,A robber tries to rob a place and the crowd panics.,Everyone in the room ran away when a thief tried to rob.,People begin running when a man tries to rob the place.
Robbery115_x264.mp4,Two robbers robs the shop.,Robbers take money from the cashier.,Robbers use a gun for robbery.,One robber enters the cashier’s cabin and takes all the money.,Robbers cover people’s face using a white cloth.
Robbery116_x264.mp4,One robber tries to enter the house.,The owner was with a dog when the thief came in.,A dog jumps on the robber.,The robber runs away after a dog jumps on him.,The robber tried to hit the owner.
Robbery117_x264.mp4,Group of robbers enter a hospital.,One lady robber uses a gun for robbery.,Robbers chase everyone to outside the hall.,They steal money from the cash counter.,A female robber uses gloves before opening the cash drawer.
Robbery118_x264.mp4,Robber uses a big gun for robbery.,Robber enters a shop in a petrol bunk.,He asks the cashier to fill the bag with cash.,The cashier fights with the robber.,The robbery fails and the robber runs out.
Robbery119_x264.mp4,Robber forces the cashier to pack the money.,Guy in a black dress steals from the store.,A person threatens the cashier to give him money.,The cashier is forced to give all the money under the fear of getting shot.,A robber walks into a store and forces the cashier to fill up money.
Robbery120_x264.mp4,Two robbers take money from the cash counter.,Robbers use a gun and threaten the cashier.,Guys takes money from the cash counter forcefully.,The cashier runs away from the cash counter on seeing a gun.,A robber jumps onto the cash counter and takes the money.
Robbery121_x264.mp4,Robber takes money from the cash counter.,Guy with black cap steals the cash counter.,Robber enters the cashier’s place and takes the money kept there.,A robber acts like a customer to gain access.,The cashier runs away when a robber entered the cash counter.
Robbery122_x264.mp4,Robber steals from a shop.,Robber uses the gun in front of the cashier.,The cashier hits the robber.,Robber takes the shop items by holding a gun.,A robber in a grey outfit robs the shop.
Robbery123_x264.mp4,A robber steals a laptop from the counter.,Robber uses knife to threaten the cashier.,Robber tries to pull the laptop from the cashier. ,The robber shows a knife to the cashier.,The guy was using a cap to cover his face.
Robbery124_x264.mp4,Robber comes to the shop like a customer with a bag.,Robber uses his gun for the robbery.,A robber steals the shop items in a bag.,The shop keeper fights with the robber.,The robber forces the shopkeeper to give cash.
Robbery125_x264.mp4,Robbers came in the store as customers.,Robber with a helmet hits the lady and steals items from the shop.,Two robbers steal from the shop.,Robbers run away after taking the shop inventory.,The shop owner was beaten by the robbers.
Robbery126_x264.mp4,A man fights with a girl to steal her money.,A robber tries to steal money from the desk.,A thief fights with the cashier to take the money.,A woman fights with the thief. ,A shop is being robbed.
Robbery127_x264.mp4,A thief tries to steal money but is beaten down by good people.,A few people catch the thief and start beating him.,A thief tries to steal something but gets caught.,Something is being stolen by the thief but he gets caught.,Two people beat the robber.
Robbery128_x264.mp4,A robber hits the cashier and then steals all the money.,Two men fight to protect the money in the shop.,A robber tries to beat the man and steal his money from the shop.,A robbery occurs in a shop and the cashier prevents it.,A robber tries to steal money from the shop.
Robbery129_x264.mp4,A man points a knife at the cashier and steals the money.,A shop is robbed by a person with a knife.,A thief steals the money from a shop by pointing a knife.,A thief points a knife and steals the money.,The shop money is stolen by a robber.
Robbery130_x264.mp4,A man with a gun beats the person and takes all the shop money.,A robbery occurs in the shop.,A person steals all the shop money.,All the money is stolen by a robber.,A robber beats the cashier and steals all the money.
Robbery131_x264.mp4,A thief points a gun at a woman and takes all the money.,A robber steals all the money from the shop.,A person tries to steal all the money in the shop.,A shop is being robbed by a person with a gun.,A person with gun tries to rob the shop and take the money.
Robbery132_x264.mp4,A person tries to steal all the money in the shop.,A shop is being robbed by a person with a gun.,A person with gun tries to steal money.,A thief points a gun at a woman and takes all the money.,A robber steals all the money from the shop.
Robbery133_x264.mp4,Two men beat a person and steal his money.,A person is being robbed by two people.,Two people rob a person in the shop.,Two robbers steal the money from the person.,A person is beaten by two people and is then robbed.
Robbery134_x264.mp4,A few men rush in the market and steal everything at gun point.,A gang of boys loot a shop.,A shop is being looted by a group of men.,A group of men with guns steal items from the shop.,A shop is robbed by a few people.
Robbery135_x264.mp4,A man wearing helmet points a gun at the person but is caught by the people in the shop.,The thief wearing helmet is caught by public and is beaten.,The shop customers beat the thief who was pointing a gun.,A robber with gun was beaten by public.,A person was being robbed by a person but he catches the robber instead.
Robbery136_x264.mp4,A robber forces the women to give them her money.,A shop is being robbed by a thief.,A thief robs the shop.,A woman is forced to give all the money in the shop.,The girl is forced by a robber to give all the money.
Robbery137_x264.mp4,Two people with a gun loot a shop.,Two boys with a gun steal the money from the shop.,A shop is robbed by two boys with guns.,Two people rob all the shop money.,The thief points a gun at the cashier and takes all the money.
Robbery138_x264.mp4,A thief beats an old man and takes his money.,An old man is beaten by a robber who then steals all his money.,All the money of an old man is stolen by a thief.,A robber hits an old man and takes the money.,The old man is robbed by a thief.
Robbery139_x264.mp4,A thief points a gun and takes all the money.,A robber steals all the money from the shop.,A person tries to steal all the money in the shop.,A shop is being robbed by a person with a gun.,A person with gun tries to steal money.
Robbery140_x264.mp4,A thief points a knife at a the cashier and takes all the money.,A robber steals all the money from the shop.,A person tries to steal all the money in the shop.,A shop is being robbed by a person with a knife.,A person with knife tries to steal money.
Robbery141_x264.mp4,Two masked men steal the money from the person.,Two robbers steal from the shop.,A shop is being looted by two people.,The cashier is forced to give money to two people.,Two thieves rush into the shop and steal the money.
Robbery142_x264.mp4,A thief with a gun takes all the money from the old man in the shop.,A shop is being robbed.,The old the cashier is forced to give all the money to robber.,An old man is forced to give money on gun point.,A robber with a gun steals the money from the shop.
Robbery143_x264.mp4,A thief points a gun and takes all the money.,A robber steals all the money from the shop.,A person tries to steal all the money in the shop.,A shop is being robbed by a person with a gun.,A person with gun tries to steal money.
Robbery144_x264.mp4,Two men on a bike steal a woman's handbag.,Two robbers steal a handbag of a woman.,An old woman is robbed by two men.,Two thieves on a bike steal a handbag.,The bikers steal a handbag from a woman.
Robbery145_x264.mp4,Two armed men steal shop items.,Two armed robbers rob a shop on gun point.,A shop is being robbed by two gun men.,A person in white hoodie steals everything in the shop with his accomplice.,Two men steal from a shop at gunpoint.
Robbery146_x264.mp4,A man tries to steal in the metro but is caught and beaten.,The robber points a gun but is caught afterwards.,People in the metro train catch the robber and beat him.,A thief is beaten in the metro train.,A man with a gun tries to steal but is caught.
Robbery147_x264.mp4,Two armed men steal from a shop.,Two people with guns steal from a shop.,A shop is being robbed by two men.,Two robbers point a gun and take the money.,The shop money is stolen by two robbers.
Robbery148_x264.mp4,A man on cycle steals the person's phone and drove away.,A mobile is stolen by a cycle rider.,A robber steals a person's mobile.,A thief on a cycle steals a mobile phone.,The mobile phone of a standing person is stolen by a robber.
Robbery149_x264.mp4,A thief tries to steal all the money from the shop but is beaten.,Two men have a fight to protect the shop money.,A robber hits the cashier to steal the money.,The cashier hits the robber to make him run away.,The shop is being robbed by a person.
Robbery150_x264.mp4,Two thieves on a bike steal from a woman.,Two bikers rob a woman.,Two men come on a bike and steal from a woman.,A woman is robbed by two bikers.,The woman was forced to give her belongings to the bikers.
